{
  "mbmap": 2,
  "vendor": "Test",
  "model": "TM-1 / TM-1A",
  "models": ["TM-1", "TM-1A"],
  "revision": 3,
  "revised": "2026-10-14",
  "firmware": "1.x and 2.x; 2.1 moved the energy counter",
  "firmware_min": "1",
  "firmware_max": "2",
  "source": "Test manual 2.1",
  "sources": [
    {"title": "TM-1 Modbus manual", "version": "2.1", "date": "2026-03", "url": "https://example.com/tm-1.pdf", "note": "tables 3 and 4"},
    {"title": "TM-1 release notes", "date": "2026"}
  ],
  "registers": [
    {"name": "Model code", "area": "holding", "address": 0, "type": "uint16", "enum": {"1": "TM-1", "2": "TM-1A"}, "role": "model"},
    {"name": "Firmware major", "area": "holding", "address": 1, "type": "uint16", "bit": 8, "bits": 8, "role": "firmware"},
    {"name": "Firmware minor", "area": "holding", "address": 1, "type": "uint16", "bit": 0, "bits": 8, "role": "firmware"},
    {"name": "Serial number", "area": "holding", "address": 2, "type": "string", "length": 4, "role": "serial"},
    {"name": "Voltage", "area": "input", "address": 10, "type": "float32", "unit": "V"},
    {"name": "Active energy", "area": "input", "address": 20, "type": "uint32", "unit": "Wh", "firmware_max": "2.0"},
    {"name": "Active energy", "area": "input", "address": 21, "type": "uint64", "unit": "Wh", "firmware_min": "2.1"},
    {"name": "Power factor", "area": "input", "address": 30, "type": "int16", "scale": 0.001, "firmware_min": "2.1"}
  ]
}
