{
  "mbmap": 2,
  "vendor": "Test",
  "model": "T1",
  "enums": {
    "run_state": {"0": "Stopped", "1": "Idle", "2": "Starting", "3": "Running", "4": "Fault"},
    "bits": {"0x0": "Off", "0x1": "On"}
  },
  "registers": [
    {"name": "Pump 1", "area": "holding", "address": 100, "type": "uint16", "enum": "run_state"},
    {"name": "Pump 2", "area": "holding", "address": 101, "type": "uint16", "enum": "run_state"},
    {"name": "Valve", "area": "coil", "address": 0, "type": "bool", "enum": "bits"},
    {"name": "Inline", "area": "holding", "address": 102, "type": "uint16", "enum": {"0": "A", "1": "B"}}
  ]
}
