{
  "mbmap": 2,
  "vendor": "Test",
  "model": "T1",
  "sentinels": {
    "uint16": {"0xFFFF": "Unimplemented", "0xFFFE": "Over range"},
    "int16": {"0x7FFF": "Unimplemented", "-32768": "Not available"},
    "uint32": {"4294967295": "Unimplemented"},
    "uint64": {"0xFFFFFFFFFFFFFFFF": "Unimplemented"}
  },
  "registers": [
    {"name": "Pressure", "area": "holding", "address": 0, "type": "uint16", "scale": 1, "unit": "kPa"},
    {"name": "Temperature", "area": "holding", "address": 1, "type": "int16", "scale": 0.1, "unit": "°C"},
    {"name": "Energy", "area": "holding", "address": 2, "type": "uint32", "scale": 0.1, "unit": "kWh"}
  ]
}
