{
  "mbmap": 2,
  "vendor": "Test",
  "model": "T1",
  "registers": [
    {"name": "A", "area": "holding", "address": 0, "type": "uint32", "colour": "red"},
    {"name": "B", "area": "holding", "address": 1, "type": "uint16", "colour": "blue"},
    {"name": "A", "area": "holding", "address": 4, "type": "uint16", "access": "R", "write_min": 1}
  ]
}
