{
  "mbmap": 2,
  "vendor": "Test",
  "model": "T1",
  "registers": [
    {"name": "Setpoint", "area": "holding", "address": 100, "type": "uint16", "scale": 0.1, "unit": "°C", "access": "RW", "write_min": 5, "write_max": 30},
    {"name": "Delay", "area": "holding", "address": 101, "type": "uint16", "unit": "s", "access": "RW", "write_min": 0},
    {"name": "Floor", "area": "holding", "address": 102, "type": "int16", "access": "W", "write_max": -15.0},
    {"name": "Fixed", "area": "holding", "address": 103, "type": "int16", "access": "RW", "write_min": 10, "write_max": 10}
  ]
}
